{
  "auditResultVersion": 1,
  "policyConfigurationVersion": 1,
  "taxonomyRegistryVersion": 1,
  "targetProfile": "profile.external-api",
  "results": [
    {
      "classification": { "recordType": "TargetClassification", "symbolRef": { "compilationContextRef": "synthetic.documentation", "documentationCommentId": "T:AuditFixtures.DocumentationWidget" }, "primaryKind": "symbol.type.class", "traits": [], "origin": "origin.source", "supportStatus": "support.supported" },
      "policyContributions": [ { "projectPath": "src/Audit.csproj", "sourcePath": "src/DocumentationWidget.cs", "policyExpectation": "required", "matchedRuleId": "required-docs" } ],
      "policyExpectation": "required",
      "policyResolution": "single",
      "documentationObservation": "documentation.unavailable",
      "auditOutcome": "audit.outcome.skipped",
      "reasonCode": "audit.reason.documentation-unavailable",
      "evidenceIds": [],
      "evidenceBundle": { "evidenceBundleVersion": 1, "availabilityStatus": "evidence.bundle.unavailable", "omissionReason": "evidence.omission.source-unavailable", "items": [] }
    }
  ]
}
