{
  "auditResultVersion": 1,
  "policyConfigurationVersion": 1,
  "taxonomyRegistryVersion": 1,
  "targetProfile": "profile.external-api",
  "results": [
    {
      "classification": {
        "recordType": "TargetClassification",
        "symbolRef": {
          "compilationContextRef": "synthetic.optional",
          "documentationCommentId": "T:AuditFixtures.OptionalWidget"
        },
        "primaryKind": "symbol.type.class",
        "traits": [],
        "origin": "origin.source",
        "supportStatus": "support.supported"
      },
      "policyContributions": [
        {
          "projectPath": "src/Audit.csproj",
          "sourcePath": "src/OptionalWidget.cs",
          "policyExpectation": "optional",
          "matchedRuleId": "optional-docs"
        }
      ],
      "policyExpectation": "optional",
      "policyResolution": "single",
      "documentationObservation": "documentation.present",
      "auditOutcome": "audit.outcome.compliant",
      "reasonCode": "audit.reason.optional-present",
      "evidenceIds": [
        "evidence.xml-doc"
      ],
      "evidenceBundle": {
        "evidenceBundleVersion": 1,
        "availabilityStatus": "evidence.bundle.complete",
        "items": [
          {
            "evidenceId": "evidence.xml-doc",
            "subject": {
              "compilationContextRef": "synthetic.optional",
              "documentationCommentId": "T:AuditFixtures.OptionalWidget"
            },
            "kind": "evidence.source.xml-documentation",
            "relation": "evidence.documents",
            "excerpt": "/// <summary>Widget docs.</summary>",
            "sha256": "7245070ca7cb1427ad4e7c502148e744d7f50f07ba86091b570795d5c1f7537f",
            "originalUtf8ByteCount": 35,
            "includedUtf8ByteCount": 35,
            "omittedUtf8ByteCount": 0,
            "isTruncated": false,
            "locator": {
              "repository": {
                "path": "src/OptionalWidget.cs"
              }
            }
          }
        ],
        "observationSubject": {
          "observationSubjectRef": "obs.7685718592e71d62afd2ef270a6a65892ba139a7792211660da6f9d38607dba5",
          "compilationContextRef": "synthetic.optional",
          "subject": {
            "compilationContextRef": "synthetic.optional",
            "documentationCommentId": "T:AuditFixtures.OptionalWidget"
          },
          "authoritativeDeclarationSetDigest": "af26d32cc3409fe7f4e8a577976b71372af4e07f7a87ac8ed1fb762149299589",
          "authoritativeDeclarationCount": 1
        }
      },
      "evidenceAuthority": {
        "declarationSetId": "dset.af26d32cc3409fe7f4e8a577976b71372af4e07f7a87ac8ed1fb762149299589",
        "completeness": "positive-only",
        "declarations": [
          {
            "declarationId": "decl.4541d3a25f66ffaa85045c1a282d920787acabab63d6380a1262fbc037e78f5a",
            "authorityRole": "ordinary",
            "blockState": "well-formed",
            "evidenceId": "evidence.xml-doc"
          }
        ]
      }
    },
    {
      "classification": {
        "recordType": "TargetClassification",
        "symbolRef": {
          "compilationContextRef": "synthetic.v1",
          "documentationCommentId": "T:AuditFixtures.Widget"
        },
        "primaryKind": "symbol.type.class",
        "traits": [],
        "origin": "origin.source",
        "supportStatus": "support.supported"
      },
      "policyContributions": [
        {
          "projectPath": "src/Audit.csproj",
          "sourcePath": "src/Widget.cs",
          "policyExpectation": "required",
          "matchedRuleId": "required-docs"
        }
      ],
      "policyExpectation": "required",
      "policyResolution": "single",
      "documentationObservation": "documentation.absent",
      "auditOutcome": "audit.outcome.violation",
      "reasonCode": "audit.reason.required-absent",
      "evidenceIds": [
        "evidence.declaration"
      ],
      "evidenceBundle": {
        "evidenceBundleVersion": 1,
        "availabilityStatus": "evidence.bundle.complete",
        "items": [
          {
            "evidenceId": "evidence.declaration",
            "subject": {
              "compilationContextRef": "synthetic.v1",
              "documentationCommentId": "T:AuditFixtures.Widget"
            },
            "kind": "evidence.source.declaration",
            "relation": "evidence.declares",
            "excerpt": "public sealed class Widget {}",
            "sha256": "c4a2507bbd33d04f2e6ba98b4c62e55b321137a389fe212401eefbf04cf3a2ad",
            "originalUtf8ByteCount": 29,
            "includedUtf8ByteCount": 29,
            "omittedUtf8ByteCount": 0,
            "isTruncated": false,
            "locator": {
              "repository": {
                "path": "src/Widget.cs"
              }
            }
          }
        ],
        "observationSubject": {
          "observationSubjectRef": "obs.610e76d8d452395c19e456fedeae19511336151a8a5ce9358680a00fd233ff95",
          "compilationContextRef": "synthetic.v1",
          "subject": {
            "compilationContextRef": "synthetic.v1",
            "documentationCommentId": "T:AuditFixtures.Widget"
          },
          "authoritativeDeclarationSetDigest": "a20338216c4f74b3f723e77efea823f65031e7c3554a4886c4eec5de92a566bf",
          "authoritativeDeclarationCount": 1
        }
      },
      "evidenceAuthority": {
        "declarationSetId": "dset.a20338216c4f74b3f723e77efea823f65031e7c3554a4886c4eec5de92a566bf",
        "completeness": "complete",
        "declarations": [
          {
            "declarationId": "decl.d8a09d677396c4d638cfebdf1c42e46c0e0ff79a79b16ab60fc88e686a3f444f",
            "authorityRole": "ordinary",
            "blockState": "no-block",
            "evidenceId": "evidence.declaration"
          }
        ]
      }
    }
  ]
}
