{
  "auditResultVersion": 1,
  "policyConfigurationVersion": 1,
  "taxonomyRegistryVersion": 1,
  "targetProfile": "profile.external-api",
  "results": [
    {
      "classification": {
        "recordType": "TargetClassification",
        "symbolRef": {
          "compilationContextRef": "synthetic.v1",
          "documentationCommentId": "T:AuditFixtures.Widget"
        },
        "primaryKind": "symbol.type.class",
        "traits": [],
        "origin": "origin.source",
        "supportStatus": "support.supported"
      },
      "policyContributions": [
        {
          "projectPath": "src/Audit.csproj",
          "sourcePath": "src/Widget.cs",
          "policyExpectation": "required",
          "matchedRuleId": "required-docs"
        }
      ],
      "policyExpectation": "required",
      "policyResolution": "single",
      "documentationObservation": "documentation.present",
      "auditOutcome": "audit.outcome.compliant",
      "reasonCode": "audit.reason.required-present",
      "evidenceIds": [
        "evidence.xml-doc"
      ],
      "evidenceBundle": {
        "evidenceBundleVersion": 1,
        "availabilityStatus": "evidence.bundle.complete",
        "items": [
          {
            "evidenceId": "evidence.xml-doc",
            "subject": {
              "compilationContextRef": "synthetic.v1",
              "documentationCommentId": "T:AuditFixtures.Widget"
            },
            "kind": "evidence.source.xml-documentation",
            "relation": "evidence.documents",
            "excerpt": "/// <summary>Widget docs.</summary>",
            "sha256": "7245070ca7cb1427ad4e7c502148e744d7f50f07ba86091b570795d5c1f7537f",
            "originalUtf8ByteCount": 35,
            "includedUtf8ByteCount": 35,
            "omittedUtf8ByteCount": 0,
            "isTruncated": false,
            "locator": {
              "repository": {
                "path": "src/Widget.cs"
              }
            }
          }
        ],
        "observationSubject": {
          "observationSubjectRef": "obs.f79ccdb22a557b971920bba749947a85380529f54a466632ad56017582e034e8",
          "compilationContextRef": "synthetic.v1",
          "subject": {
            "compilationContextRef": "synthetic.v1",
            "documentationCommentId": "T:AuditFixtures.Widget"
          },
          "authoritativeDeclarationSetDigest": "af26d32cc3409fe7f4e8a577976b71372af4e07f7a87ac8ed1fb762149299589",
          "authoritativeDeclarationCount": 1
        }
      },
      "evidenceAuthority": {
        "declarationSetId": "dset.af26d32cc3409fe7f4e8a577976b71372af4e07f7a87ac8ed1fb762149299589",
        "completeness": "positive-only",
        "declarations": [
          {
            "declarationId": "decl.4541d3a25f66ffaa85045c1a282d920787acabab63d6380a1262fbc037e78f5a",
            "authorityRole": "ordinary",
            "blockState": "well-formed",
            "evidenceId": "evidence.xml-doc"
          }
        ]
      }
    }
  ]
}
