{
  "auditResultVersion": 1,
  "policyConfigurationVersion": 1,
  "taxonomyRegistryVersion": 1,
  "targetProfile": "profile.external-api",
  "results": [
    {
      "classification": { "recordType": "TargetClassification", "symbolRef": { "compilationContextRef": "synthetic.optional", "documentationCommentId": "T:AuditFixtures.OptionalWidget" }, "primaryKind": "symbol.type.class", "traits": [], "origin": "origin.source", "supportStatus": "support.supported" },
      "policyContributions": [ { "projectPath": "src/Audit.csproj", "sourcePath": "src/OptionalWidget.cs", "policyExpectation": "optional", "matchedRuleId": "optional-docs" } ],
      "policyExpectation": "optional",
      "policyResolution": "single",
      "documentationObservation": "documentation.present",
      "auditOutcome": "audit.outcome.compliant",
      "reasonCode": "audit.reason.optional-present",
      "evidenceIds": [ "evidence.xml-doc" ],
      "evidenceBundle": { "evidenceBundleVersion": 1, "availabilityStatus": "evidence.bundle.complete", "items": [ { "evidenceId": "evidence.xml-doc", "subject": { "compilationContextRef": "synthetic.optional", "documentationCommentId": "T:AuditFixtures.OptionalWidget" }, "kind": "evidence.source.xml-documentation", "relation": "evidence.documents", "excerpt": "/// <summary>Widget docs.</summary>", "sha256": "7245070ca7cb1427ad4e7c502148e744d7f50f07ba86091b570795d5c1f7537f", "originalUtf8ByteCount": 35, "includedUtf8ByteCount": 35, "omittedUtf8ByteCount": 0, "isTruncated": false, "locator": { "repository": { "path": "src/OptionalWidget.cs" } } } ] }
    }
  ]
}
