{
  "auditResultVersion": 1,
  "policyConfigurationVersion": 1,
  "taxonomyRegistryVersion": 1,
  "targetProfile": "profile.external-api",
  "results": [
    {
      "classification": { "recordType": "TargetClassification", "symbolRef": { "compilationContextRef": "synthetic.ambiguous", "documentationCommentId": "T:AuditFixtures.AmbiguousWidget" }, "primaryKind": "symbol.type.class", "traits": [], "origin": "origin.mixed", "supportStatus": "support.ambiguous", "skipReason": "skip.ambiguous.mixed-origin" },
      "policyContributions": [ { "projectPath": "src/Audit.csproj", "sourcePath": "generated/AmbiguousWidget.cs", "policyExpectation": "forbidden", "matchedRuleId": "generated-forbidden" }, { "projectPath": "src/Audit.csproj", "sourcePath": "src/AmbiguousWidget.cs", "policyExpectation": "required", "matchedRuleId": "required-docs" } ],
      "policyExpectation": null,
      "policyResolution": "unavailable",
      "documentationObservation": null,
      "auditOutcome": "audit.outcome.skipped",
      "reasonCode": "audit.reason.classification-skipped",
      "evidenceIds": [],
      "evidenceBundle": { "evidenceBundleVersion": 1, "availabilityStatus": "evidence.bundle.unavailable", "omissionReason": "evidence.omission.not-provided", "items": [] }
    }
  ]
}
