{
  "auditResultVersion": 1,
  "policyConfigurationVersion": 1,
  "taxonomyRegistryVersion": 1,
  "targetProfile": "profile.external-api",
  "results": [
    {
      "classification": {
        "recordType": "TargetClassification",
        "symbolRef": {
          "compilationContextRef": "synthetic.v1",
          "documentationCommentId": "T:AuditFixtures.Widget"
        },
        "primaryKind": "symbol.type.class",
        "traits": [],
        "origin": "origin.source",
        "supportStatus": "support.supported"
      },
      "policyContributions": [
        {
          "projectPath": "src/Audit.csproj",
          "sourcePath": "src/Widget.cs",
          "policyExpectation": "required",
          "matchedRuleId": "required-docs"
        }
      ],
      "policyExpectation": "required",
      "policyResolution": "single",
      "documentationObservation": "documentation.absent",
      "auditOutcome": "audit.outcome.violation",
      "reasonCode": "audit.reason.required-absent",
      "evidenceIds": [
        "evidence.declaration"
      ],
      "evidenceBundle": {
        "evidenceBundleVersion": 1,
        "availabilityStatus": "evidence.bundle.complete",
        "items": [
          {
            "evidenceId": "evidence.declaration",
            "subject": {
              "compilationContextRef": "synthetic.v1",
              "documentationCommentId": "T:AuditFixtures.Widget"
            },
            "kind": "evidence.source.declaration",
            "relation": "evidence.declares",
            "excerpt": "public sealed class Widget {}",
            "sha256": "c4a2507bbd33d04f2e6ba98b4c62e55b321137a389fe212401eefbf04cf3a2ad",
            "originalUtf8ByteCount": 29,
            "includedUtf8ByteCount": 29,
            "omittedUtf8ByteCount": 0,
            "isTruncated": false,
            "locator": {
              "repository": {
                "path": "src/Widget.cs"
              }
            }
          }
        ],
        "observationSubject": {
          "observationSubjectRef": "obs.610e76d8d452395c19e456fedeae19511336151a8a5ce9358680a00fd233ff95",
          "compilationContextRef": "synthetic.v1",
          "subject": {
            "compilationContextRef": "synthetic.v1",
            "documentationCommentId": "T:AuditFixtures.Widget"
          },
          "authoritativeDeclarationSetDigest": "a20338216c4f74b3f723e77efea823f65031e7c3554a4886c4eec5de92a566bf",
          "authoritativeDeclarationCount": 1
        }
      },
      "evidenceAuthority": {
        "declarationSetId": "dset.a20338216c4f74b3f723e77efea823f65031e7c3554a4886c4eec5de92a566bf",
        "completeness": "complete",
        "declarations": [
          {
            "declarationId": "decl.d8a09d677396c4d638cfebdf1c42e46c0e0ff79a79b16ab60fc88e686a3f444f",
            "authorityRole": "ordinary",
            "blockState": "no-block",
            "evidenceId": "evidence.declaration"
          }
        ]
      }
    }
  ]
}
